url,filename,uppercaption,lowercaption,views,upvote
https://i.imgflip.com/z44jt.jpg,The-Most-Interesting-Cat-In-The-World.jpg,i don't always act like the most interesting man in the world,"but when i do, i have to make a very good meme to prove it.",731,5
https://i.imgflip.com/1aq3h0.jpg,The-Most-Interesting-Cat-In-The-World.jpg,i don't always give a crap,"but when i do,     it's in the litter box    with the rest of my poop,,,",1056,5
https://i.imgflip.com/10jlo9.jpg,The-Most-Interesting-Cat-In-The-World.jpg,name a song that puts,you in the mood,663,0
https://i.imgflip.com/10vnbv.jpg,The-Most-Interesting-Cat-In-The-World.jpg,and i was like,give me a shot of milk,843,4
https://i.imgflip.com/1f6a5o.jpg,The-Most-Interesting-Cat-In-The-World.jpg,i don't always catch a mouse,but when i do i bring it to you to show you,819,3
https://i.imgflip.com/10bsxt.jpg,The-Most-Interesting-Cat-In-The-World.jpg,i don't always get the red dot,"but when i do, it goes somewhere else",725,3
https://i.imgflip.com/z490o.jpg,The-Most-Interesting-Cat-In-The-World.jpg,"when i drink, it's from the toilet","stay thirsty, my friend",718,4
https://i.imgflip.com/1l9l47.jpg,The-Most-Interesting-Cat-In-The-World.jpg,i don't always sit down with you,"but when i do, i wait for you to be doing homework and then sit on your books.",889,2
https://i.imgflip.com/1bz05s.jpg,The-Most-Interesting-Cat-In-The-World.jpg,hey tony,your yard sucks!,719,3
https://i.imgflip.com/180l0u.jpg,The-Most-Interesting-Cat-In-The-World.jpg,i don't always walk on your keyboard,but when i do your using it,1117,2
https://i.imgflip.com/xfk5l.jpg,The-Most-Interesting-Cat-In-The-World.jpg,i don't always hang out at the scratching post,"but when i do, it's for you, baby",1770,2
https://i.imgflip.com/10bt05.jpg,The-Most-Interesting-Cat-In-The-World.jpg,so your'e saying:,"you want to bathe me, and you don't expect to get clawed in the face?",1359,2
https://i.imgflip.com/1ip0w2.jpg,The-Most-Interesting-Cat-In-The-World.jpg,my litter box is,most interesting than u r,629,0
https://i.imgflip.com/21auqv.jpg,The-Most-Interesting-Cat-In-The-World.jpg,meri saari batain,mano,321,2
https://i.imgflip.com/20lj9x.jpg,The-Most-Interesting-Cat-In-The-World.jpg,happy birthday keith,stay thirsty my friend,406,1
https://i.imgflip.com/zp8tj.jpg,The-Most-Interesting-Cat-In-The-World.jpg,i eat out of garbage cans,i hide under cars at night time,900,2
https://i.imgflip.com/1xnuwq.jpg,The-Most-Interesting-Cat-In-The-World.jpg,whenever i meow my owner,always feeds me meat,391,1
https://i.imgflip.com/1kd5jc.jpg,The-Most-Interesting-Cat-In-The-World.jpg,enemies and enemas,both belong in your butt,658,1
https://i.imgflip.com/1hbs7t.jpg,The-Most-Interesting-Cat-In-The-World.jpg,i don't always hide from my owners when they tell me that it's bath time,but when i do they give me cans of tuna,623,1
https://i.imgflip.com/112pzn.jpg,The-Most-Interesting-Cat-In-The-World.jpg,spring break,has arrived!!,2132,1
https://i.imgflip.com/17jxf9.jpg,The-Most-Interesting-Cat-In-The-World.jpg,your human failures,really amaze me sometimes,1085,1
https://i.imgflip.com/15wj82.jpg,The-Most-Interesting-Cat-In-The-World.jpg,i don't always crap in the house,but when i do i make sure it's in the kitchen when you're cooking,533,1
https://i.imgflip.com/1404a4.jpg,The-Most-Interesting-Cat-In-The-World.jpg,"""so, why didn't you get","the homework done?""",311,1
https://i.imgflip.com/1svlz5.jpg,The-Most-Interesting-Cat-In-The-World.jpg,"hey ladies, i have a 6 digit bank account and guns of steal",can't you tell?,198,1
https://i.imgflip.com/12zoz2.jpg,The-Most-Interesting-Cat-In-The-World.jpg,"my face when people  keep asking: ""when are you guys getting married?""",stop asking!!!! @tashee_appeal,645,1
https://i.imgflip.com/4mcq3b.jpg,The-Most-Interesting-Cat-In-The-World.jpg,this is how a try to look,after having a microspleep straight in your face while you were telling me a boring story,110,0
https://i.imgflip.com/4gh093.jpg,The-Most-Interesting-Cat-In-The-World.jpg,i don't always want schleppe,"but when i do, i want schleppe",102,0
https://i.imgflip.com/4awuyb.jpg,The-Most-Interesting-Cat-In-The-World.jpg,i don't often order a sausage mcmuffin,"but when i do, i always say, with egg",184,0
https://i.imgflip.com/3orhre.jpg,The-Most-Interesting-Cat-In-The-World.jpg,i donâ€™t always use google translate for my hw,"but when i do, i make sure to not use it for irish",378,0
https://i.imgflip.com/2i8by5.jpg,The-Most-Interesting-Cat-In-The-World.jpg,i donâ€™t usually like rats,but sometimes theyâ€™re in the rival gang,263,0
https://i.imgflip.com/2aggdo.jpg,The-Most-Interesting-Cat-In-The-World.jpg,i don't  always  catch  the  mouse,but when i do it my dinner,107,0
https://i.imgflip.com/2afma8.jpg,The-Most-Interesting-Cat-In-The-World.jpg,"i donâ€™t always run, play, destroy the house and want to be petted","but when i do, itâ€™s 3 oâ€™clock in the morning",106,0
https://i.imgflip.com/29z2g4.jpg,The-Most-Interesting-Cat-In-The-World.jpg,i dont always play with the dot,but when i do it is always green,152,0
https://i.imgflip.com/29ta0c.jpg,The-Most-Interesting-Cat-In-The-World.jpg,ecia,establishing comunism in america,125,0
https://i.imgflip.com/28glgw.jpg,The-Most-Interesting-Cat-In-The-World.jpg,"so this is what you call ""spring""",in south dakota?,137,0
https://i.imgflip.com/281hys.jpg,The-Most-Interesting-Cat-In-The-World.jpg,how god be lookin,when he aint dead,81,0
https://i.imgflip.com/2059qg.jpg,The-Most-Interesting-Cat-In-The-World.jpg,"Ã— parÂ·kour pÃ¤rËˆkoÍor the activity or sport of moving rapidly through an area, typically in an urban environment, negotiating obstacles by running, jumping, and climbing",when doing so i always land on my feet,194,0
https://i.imgflip.com/1na34e.jpg,The-Most-Interesting-Cat-In-The-World.jpg,i dont always sit on your face,but when i do i make sure to take a dump,190,1
https://i.imgflip.com/109hs8.jpg,The-Most-Interesting-Cat-In-The-World.jpg,why does everbody like purring,its actually me getting ready to shit,236,0
https://i.imgflip.com/xxupm.jpg,The-Most-Interesting-Cat-In-The-World.jpg,i'm not gonna make a post on facebook anymore,if i got something to say i'm gonna do it like this. an ps i just had dinner an i'm going to visit my wife's kids in fall river.,489,0
https://i.imgflip.com/n6c8j.jpg,The-Most-Interesting-Cat-In-The-World.jpg,me-ow ,,157,0
https://i.imgflip.com/13qgme.jpg,The-Most-Interesting-Cat-In-The-World.jpg,madmins here are the best,meme away peasants!,427,0
https://i.imgflip.com/5zwpca.jpg,Scumbag-Boss.jpg,your two week holiday vacation is over,now get back to work!,234,0
https://i.imgflip.com/3t65fp.jpg,Scumbag-Boss.jpg,we know about the coronavirus,you still have to report to work. just let us know when youâ€™re sick.,114783,0
https://i.imgflip.com/350x3x.jpg,Scumbag-Boss.jpg,gives you 39 hours a week,so he doesn't give you full time employee benefits/perks,6750,0
https://i.imgflip.com/3dkh45.jpg,Scumbag-Boss.jpg,hard work has never killed anyone,who supervises it.,17219,0
https://i.imgflip.com/2zew7g.jpg,Scumbag-Boss.jpg,i've been reading a lot recently about the damage smoking and drinking can do to your health,so i've decided - i'm giving up reading,4029,0
https://i.imgflip.com/1dd7ji.jpg,Scumbag-Boss.jpg,i've decided to promote you,to customer,46661,0
https://i.imgflip.com/3c534l.jpg,Scumbag-Boss.jpg,gets in trouble for letting you work  overtime,denies he gave you permission and writes you up,9013,0
https://i.imgflip.com/21kxfn.jpg,Scumbag-Boss.jpg,threatens to fire anyone who doesn't show up on holiday weekend,nowhere to be found,760011,0
https://i.imgflip.com/1z4odc.jpg,Scumbag-Boss.jpg,this company is just like a family,you spend your holidays with us,3309,0
https://i.imgflip.com/2nuz09.jpg,Scumbag-Boss.jpg,can't run the company without you,treats you like shit,4822,0
https://i.imgflip.com/4t1vky.jpg,Scumbag-Boss.jpg,because we value the health and well being of our customers,we are now offering 100% contactless service our delivery people will not enter your home all packages will be left safely at the curb,1271,3
https://i.imgflip.com/4gljzk.jpg,Scumbag-Boss.jpg,you think you could get away with,dating my sister,913,0
https://i.imgflip.com/3mtgmm.jpg,Scumbag-Boss.jpg,requires a doctor's note if you call in sick,doesn't offer health insurance,597208,4
https://i.imgflip.com/1vbht4.jpg,Scumbag-Boss.jpg,build me a vending machine,"that shows fun sized candy bars, under a big magnifying glass front panel.",2705,0
https://i.imgflip.com/3ey7sw.jpg,Scumbag-Boss.jpg,my door is always open,just not for you.,1676,8
https://i.imgflip.com/2jy5p7.jpg,Scumbag-Boss.jpg,tells you that a spreadsheet needs to be updated by the end of the day,locks his computer and leaves early with the spreadsheet still open,5343,0
https://i.imgflip.com/3okuf2.jpg,Scumbag-Boss.jpg,everyone gets trained in every department of the store,just to drive home the fact that you all are disposable,2621,5
https://i.imgflip.com/2mtgta.jpg,Scumbag-Boss.jpg,changes schedule and doesn't tell me while leaving the old schedule posted up,says its my fault for not knowing and to only go by the emailed out schedule that is sent barely 12 hours before it starts,3493,0
https://i.imgflip.com/3chqil.jpg,Scumbag-Boss.jpg,if you lose interest in a person because they work a lot,you deserve a bum,2324,8
https://i.imgflip.com/1def7e.jpg,Scumbag-Boss.jpg,uses me to do most of moving to the new building,fires me two weeks after move,3511,0
https://i.imgflip.com/2r1sgw.jpg,Scumbag-Boss.jpg,bosses are like if we don't train you,you can't say we trained you poorly,1778,0
https://i.imgflip.com/1wsj4t.jpg,Scumbag-Boss.jpg,makes employees wear uniforms,dresses like a customer,2670,0
https://i.imgflip.com/1fvp6n.jpg,Scumbag-Boss.jpg,so i heard it was your birthday today and all,but do you mind working a double shift,7488,0
https://i.imgflip.com/220tdx.jpg,Scumbag-Boss.jpg,it's just not in the budget to fix the heater,for only one person,16941,0
https://i.imgflip.com/4inuau.jpg,Scumbag-Boss.jpg,my boss having the audacity to accuse me of a drug problem,when he knows damn well he doesn't pay me enough to afford drugs,1917,0
https://i.imgflip.com/31sbpl.jpg,Scumbag-Boss.jpg,"'no headphones in the office, you should be focused on your job'",walks around whistling all day,3444,0
https://i.imgflip.com/3aich3.jpg,Scumbag-Boss.jpg,all employees must complete the webinar about sexual harrassment in the workplace,"and if you don't, i'll paddle your cute little bottoms",2229,5
https://i.imgflip.com/yyq33.jpg,Scumbag-Boss.jpg,can't get a job without experience,can't get experience without a job,8823,0
https://i.imgflip.com/1n5rvz.jpg,Scumbag-Boss.jpg,"""you work too slowly, you need to speed things up!""",says the boss who still types with two fingers!,2122,0
https://i.imgflip.com/zfiu3.jpg,Scumbag-Boss.jpg,the beatings will continue,until morale improves,16623,0
https://i.imgflip.com/1vsmuw.jpg,Scumbag-Boss.jpg,works you 39hrs,sorry since you're not full time youre not eligible for benefits,1648,0
https://i.imgflip.com/zt27e.jpg,Scumbag-Boss.jpg,texts: roads are fine to come to work today,works from home,352117,0
https://i.imgflip.com/228hsn.jpg,Scumbag-Boss.jpg,says not to come to work sick,gets mad about all the people who are calling out and threatens to write people up for calling in,7495,9
https://i.imgflip.com/290irb.jpg,Scumbag-Boss.jpg,"sorry, no promotion until you have a degree","no, i will not approve this tuition reimbursement. the class is not specific to your current position",33759,7
https://i.imgflip.com/zeuoy.jpg,Scumbag-Boss.jpg,complains to me that he spent $50k to replace all the windows on his beach front home before hurricane season,always gives speeches about how we are a small company and as soon as we start making more money we will all be paid more accordingly,288804,0
https://i.imgflip.com/2dj40g.jpg,Scumbag-Boss.jpg,there is no corelation,between stress and all our workplace accidents,22711,0
https://i.imgflip.com/18fyi9.jpg,Scumbag-Boss.jpg,work 8 hours and 40 minutes. paid 8 hours,work 7 hours and 45 minutes. paid 7 hours and 45 minutes,1841,0
https://i.imgflip.com/18yxkf.jpg,Scumbag-Boss.jpg,allows you to take your 10-minute break,5 minutes before you're scheduled to leave,4941,13
https://i.imgflip.com/2tyxvv.jpg,Scumbag-Boss.jpg,asks if you have kids or are married,says you don't need time off then,862,4
https://i.imgflip.com/1k4n1n.jpg,Scumbag-Boss.jpg,i want you to find a bold and innovative way to do everything,exactly the same way it's been done for the last 25 years,3708,0
https://i.imgflip.com/1vt0du.jpg,Scumbag-Boss.jpg,i know it was your idea,"but , it was my idea to use your idea",5518,0
https://i.imgflip.com/2pdwac.jpg,Scumbag-Boss.jpg,i'm letting you go,because you won't let me push you around,750,0
https://i.imgflip.com/2rp497.jpg,Scumbag-Boss.jpg,can't run company without you,makes new rule that makes you work every holiday.,5035,0
https://i.imgflip.com/17tn17.jpg,Scumbag-Boss.jpg,7% raise,by switching from 37.5 to 40 hour work week.,5093,14
https://i.imgflip.com/1wjgfr.jpg,Scumbag-Boss.jpg,store is understaffed,hires more management,2576,0
https://i.imgflip.com/10wbip.jpg,Scumbag-Boss.jpg,"can't pay me because the store is ""low on cash""",buys copious amounts of drugs and alcohol every week,6388,0
https://i.imgflip.com/1x8s47.jpg,Scumbag-Boss.jpg,hears that someone got injured,first question is employee or customer?,2081,0
https://i.imgflip.com/1ryxzm.jpg,Scumbag-Boss.jpg,makes his employees work on the 4th of july,takes the day off to spend time with his own family,2403,0
https://i.imgflip.com/ybhyc.jpg,Scumbag-Boss.jpg,to err is human,to blame it on someone else shows management potential,10917,0
https://i.imgflip.com/33gw5c.jpg,Scumbag-Boss.jpg,retires after being your manager since the company was founded,"""i'm not willing to be a reference for you because i don't want to work against the interests of the organization.""",2294,0
https://i.imgflip.com/1hvg4b.jpg,Scumbag-Boss.jpg,"yeah, we have profit sharing",it's called your paycheck,5655,0
https://i.imgflip.com/18c6hk.jpg,Scumbag-Boss.jpg,tells you that you have to work late,yells at you for texting your girlfriend to tell her you have to work late,3120,0
https://i.imgflip.com/18iqdj.jpg,Scumbag-Boss.jpg,doesn't hire you after 2 interviews,adds you to the corporate email list so you can get spam,4664,0
https://i.imgflip.com/1w83ld.jpg,Scumbag-Boss.jpg,i hear you are in the hospital,we got a lot of work to do and it ain't getting done with you in the hospital,2389,0
https://i.imgflip.com/13dxyj.jpg,Scumbag-Boss.jpg,makes us work a full shift saturday saying we are all in the same boat,takes a two hour lunch then leaves two hours before the rest of us,4004,0
https://i.imgflip.com/yqrf5.jpg,Scumbag-Boss.jpg,constantly jumps in front of me when i start doing anything and says she'll do it herself,goes on a 10 minute tirade about how i need to help her out more and stop letting her do everything,8485,0
https://i.imgflip.com/1vsnbt.jpg,Scumbag-Boss.jpg,rubs himself on you,while getting around you in small break room,882,0
https://i.imgflip.com/yp680.jpg,Scumbag-Boss.jpg,purposely understaffs our hospital unit everyday for months at the expense of patients and employees,to meet the budget and receive a  bonus,14540,0
https://i.imgflip.com/18jwmm.jpg,Scumbag-Boss.jpg,equipment already can't cook food as fast as we are taking orders,adds another register so we take more orders and then yells at us for not keeping up,1552,0
https://i.imgflip.com/14lahh.jpg,Scumbag-Boss.jpg,tells you to come up with an idea to solve a work problem,"steals your idea, but it fails to fix the problem. blames you at the board meeting for not fixing his problem.",7268,11
https://i.imgflip.com/1y9yxe.jpg,Scumbag-Boss.jpg,of course we're an equal opportunity employer,we make sure to have the same number of x and y chromosomes in top management,1186,6
https://i.imgflip.com/1efp1x.jpg,Scumbag-Boss.jpg,and sell you for what you think you're worth,i wish that i could buy you for what you're worth,1597,0
https://i.imgflip.com/19i469.jpg,Scumbag-Boss.jpg,calls you when you're broken down on the side of the highway,continues to try to discuss a project,3994,0
https://i.imgflip.com/19qkpl.jpg,Scumbag-Boss.jpg,"refuses to pay me legally owed overtime because ""overtime is only more than 8 hours a day, not more than 40 a work week""","schedules me for seven 8 hour shifts in a row, sunday to saturday",308011,0
https://i.imgflip.com/2u1bqu.jpg,Scumbag-Boss.jpg,the toes you step on today,may very well be connected to the ass you must kiss tomorrow.,1029,0
https://i.imgflip.com/18hm4f.jpg,Scumbag-Boss.jpg,you're over qualified for our entry level positions,you don't have enough experience for our professional level,87643,0
https://i.imgflip.com/2plsmp.jpg,Scumbag-Boss.jpg,because you're just a contractor,we get to treat you like crap,419,3
https://i.imgflip.com/11ys9a.jpg,Scumbag-Boss.jpg,"""we don't break any laws""","""give me a list of people who told you that""",10584,0
https://i.imgflip.com/yf7zb.jpg,Scumbag-Boss.jpg,doesn't give advance notice of terminations or layoffs,becomes upset that you don't give two weeks notice,4512,10
https://i.imgflip.com/190tkc.jpg,Scumbag-Boss.jpg,need part time worker,with full time availability,36896,0
https://i.imgflip.com/117q30.jpg,Scumbag-Boss.jpg,"sorry, there's no money for raises this year",brags about his bonus,1223,10
https://i.imgflip.com/13w37d.jpg,Scumbag-Boss.jpg,since i can change my gender now,i'm eligible for government contracts for women owned businesses,3610,9
https://i.imgflip.com/1cmpln.jpg,Scumbag-Boss.jpg,"""be ready to work at 6:45 am tomorrow morning or you're fired""",shows up 30 minutes late.  every day since he became store manager,4246,0
https://i.imgflip.com/1p490n.jpg,Scumbag-Boss.jpg,a customer verbally abused you,this better not happen again,2626,6
https://i.imgflip.com/1ropjn.jpg,Scumbag-Boss.jpg,"2016 ""you are not doing anything extra so i can't give you a raise this year""","2017 ""all the extra work you are doing is not part of your job so i can't give you a raise""",6987,0
https://i.imgflip.com/1r94rn.jpg,Scumbag-Boss.jpg,valued retail employees,must park farthest from the building,1204,6
https://i.imgflip.com/202zul.jpg,Scumbag-Boss.jpg,restroom  fan  breaks  down,orders  a  case  of  febreeze,941,5
https://i.imgflip.com/1f1vi2.jpg,Scumbag-Boss.jpg,fires employee on christmas eve in order to have the money to buy his wife a coat made from real panda fur by child slave workers,so she can have something nice to wear while eating veal and not leaving a tip,2159,0
https://i.imgflip.com/1301kj.jpg,Scumbag-Boss.jpg,hires only women,saves the company 23 percent on labor.,12236,9
https://i.imgflip.com/2rjgqu.jpg,Scumbag-Boss.jpg,thanks for filling out our 30-minute math and word problem section and 200 problem questionnaire,we won't be calling you back,3579,2
https://i.imgflip.com/18yxdf.jpg,Scumbag-Boss.jpg,requires that you request vacation time 2 weeks in advance,only schedules you 1 week in advance,803,9
https://i.imgflip.com/12gdwd.jpg,Scumbag-Boss.jpg,we don't want to promote you,because it would take a month to train your replacement,4751,0
https://i.imgflip.com/316f39.jpg,Scumbag-Boss.jpg,we found you logged in on facebook at work,"get your ass working, now!",574,2
https://i.imgflip.com/1u8btn.jpg,Scumbag-Boss.jpg,has the same answer for everyone,asking for a raise or time off,1559,5
https://i.imgflip.com/10aae2.jpg,Scumbag-Boss.jpg,"mimimum wage job, requires 'occasional saturdays'","""you're on call every day for the next seven months.  if you don't answer the phone when i call, you're fired.""",11329,8
https://i.imgflip.com/10ltho.jpg,Scumbag-Boss.jpg,company policy to give you 2 weeks paid vacation every year,frowns upon it if you ever use it,9049,9
https://i.imgflip.com/1a49gz.jpg,Scumbag-Boss.jpg,illegally docks paycheck $250 for leaving without 2 weeks notice,to start chemotherapy,328869,5
https://i.imgflip.com/13xxlh.jpg,Scumbag-Boss.jpg,"request vacation time 2 weeks in advance, boss approves with signature.  boss changes mind and says i can't go.  i prove to hr that the boss signed approval and i go on vacation","come back to no job, because i'm fired for not coming into work when scheduled.  i was scheduled because another worker with seniority went on vacation the same time i did.",24759,7
https://i.imgflip.com/zoal7.jpg,Scumbag-Boss.jpg,asks you about your weaknesses,doesn`t hire you when you answer him honestly,1821,0
https://i.imgflip.com/19q7r3.jpg,Scumbag-Boss.jpg,"denies your request for a raise because ""it would be unfair to others with more seniority""",hires a new person at a higher salary than you,17651,0
https://i.imgflip.com/1cwbuv.jpg,Scumbag-Boss.jpg,tells you to do something,gets mad at you for doing it,956,7
https://i.imgflip.com/14bamw.jpg,Scumbag-Boss.jpg,gives me paycheck without statement,bans me from the store and threatens to call police when i told him it is illegal,15255,7
https://i.imgflip.com/1v0jw5.jpg,Scumbag-Boss.jpg,"""i require you to give me two weeks of notice before you quit.""","okay, here are my badge and keys right now.  i'll be back at work when i can get into the building.",2322,0
https://i.imgflip.com/1rdhlw.jpg,Scumbag-Boss.jpg,its payday,next month,1180,5
https://i.imgflip.com/11k2cm.jpg,Scumbag-Boss.jpg,we offer competetive wages,i compete with other owners to pay the least,1358,8
https://i.imgflip.com/18l747.jpg,Scumbag-Boss.jpg,dislikes you for no apparent reason,writes up a crappy performance report on you and sends it to his boss,2367,0
https://i.imgflip.com/10mgz5.jpg,Scumbag-Boss.jpg,threaten to contact irs after he mailed my w2 to the wrong address and sent a blurry picture via text,thats unacceptable we've made every effort to get it to you and will see you in court.,94284,0
https://i.imgflip.com/21la8m.jpg,Scumbag-Boss.jpg,sends you home for puking your guts out,calls an hour later and mad you won't come back in,10721,3
https://i.imgflip.com/1ccy1c.jpg,Scumbag-Boss.jpg,assistant manager wants me to drive 2 hours out of my way to look at a job,"operations manager didn't know he asked me to,  and sends me to a different job that we messed up on the  day before",6856,0
https://i.imgflip.com/11gcs9.jpg,Scumbag-Boss.jpg,"co worker puts in 2 weeks notice, taking job closer to home so he could spend more time with family","""oh, did your 'god' tell you to do this?""",10322,7
https://i.imgflip.com/2vy6nm.jpg,Scumbag-Boss.jpg,the meetings will continue,until productivity improves,898,2
https://i.imgflip.com/16rbux.jpg,Scumbag-Boss.jpg,i want employees who are invested and care just as much as i do so we can grow,"shit pay, no benefits",178290,6
https://i.imgflip.com/12ppcc.jpg,Scumbag-Boss.jpg,something to remember,every dog turd has one fly on it that thinks he's the king of the world,4216,7
https://i.imgflip.com/1g0eha.jpg,Scumbag-Boss.jpg,my subordinates have problem with me name calling them,i don't know what these f*** morons are whining about?,8825,5
https://i.imgflip.com/114wwd.jpg,Scumbag-Boss.jpg,if your stupid ideas could materialize and fly,we would have 3 death stars by now,2357,0
https://i.imgflip.com/12osvu.jpg,Scumbag-Boss.jpg,declares no more birthday celebrations at work,exec secretary expects you to sign giant birthday card and sing happy birthday to him on his birthday,24718,6
https://i.imgflip.com/19t820.jpg,Scumbag-Boss.jpg,berates us for not sticking to policy,writes us up for not breaking policy to make a customer happy,24548,6
https://i.imgflip.com/1y567e.jpg,Scumbag-Boss.jpg,i will donate a meal to people who are starving,only if you buy my shit.,871,4
https://i.imgflip.com/ym4gv.jpg,Scumbag-Boss.jpg,purposely holds tax documents until last minute,because he is bitter that you quit 6 months ago,4675,7
https://i.imgflip.com/2o6a9v.jpg,Scumbag-Boss.jpg,cuts hours to five hours a week without telling anyone,refuses to pay full hours and complains about lack of dedication,1473,2
https://i.imgflip.com/15yxd5.jpg,Scumbag-Boss.jpg,denies all employees requesting days off becuase we're understaffed,won't hire anyone,46423,6
https://i.imgflip.com/18e3ww.jpg,Scumbag-Boss.jpg,criticizes your work,"when asked for some pointers says ""i don't know how to do your job, i'm just a supervisor""",128822,0
https://i.imgflip.com/1225z3.jpg,Scumbag-Boss.jpg,gives you promotion with fancy new job title and more responsibility,no pay rise,6269,0
https://i.imgflip.com/1dawlg.jpg,Scumbag-Boss.jpg,plays spooky sounds for halloween,in massage therapy treatment rooms,4201,5
https://i.imgflip.com/y94zn.jpg,Scumbag-Boss.jpg,employee politely complains about being treated poorly and disrespected by manager,manager: why do you derserve dignity? you work in food service for $9/hr.,6961,0
https://i.imgflip.com/2u6m2o.jpg,Scumbag-Boss.jpg,gets mad employees are worried about long commutes home during a snow storm,doesn't pay enough to live within half an hour of the office,5967,1
https://i.imgflip.com/2pt9ta.jpg,Scumbag-Boss.jpg,makes us come in the day after christmas for the first time in 6 years,takes the day off while we all have to work,8808,1
https://i.imgflip.com/17mona.jpg,Scumbag-Boss.jpg,eats my lunch,"buys everyone in office lunch, except me, because ""shit happens""",96442,6
https://i.imgflip.com/zikm5.jpg,Scumbag-Boss.jpg,claims christianity to get votes,calls the poor lazy so they don't have to pay for them,13241,0
https://i.imgflip.com/151uvh.jpg,Scumbag-Boss.jpg,has had a partner for the firm for 5+ years,"writes up a legal document demoting you, less pay, and expects you to sign it without talking about it",3160,0
https://i.imgflip.com/19qzmc.jpg,Scumbag-Boss.jpg,fires me for using 8 hours of my extensively accrued sick time because,"""we both know you weren't sick.""",4278,5
