url,filename,uppercaption,lowercaption,views,upvote
https://i.imgflip.com/17j16y.jpg,Duck-Face-Chicks.jpg,hookers be like,been working overtime,7276,0
https://i.imgflip.com/zuamf.jpg,Duck-Face-Chicks.jpg,when you ask a rez,girl for directions,18099,0
https://i.imgflip.com/19igj7.jpg,Duck-Face-Chicks.jpg,and people say,the 90's were bad,1589,2
https://i.imgflip.com/1a2qx1.jpg,Duck-Face-Chicks.jpg,when you,wanna be a kardashian,1167,2
https://i.imgflip.com/112n9e.jpg,Duck-Face-Chicks.jpg,we boted por hillary,we lubes us some pree stupp. these lips ain't making us any money!,2463,3
https://i.imgflip.com/1rqirs.jpg,Duck-Face-Chicks.jpg,dont get,lippy,24776,0
https://i.imgflip.com/12p6sp.jpg,Duck-Face-Chicks.jpg,these girls will never drown,can be used as a personal floatation device,950,2
https://i.imgflip.com/1gayp8.jpg,Duck-Face-Chicks.jpg,buys lipstick,by the ton now!,2093,1
https://i.imgflip.com/1g7rjr.jpg,Duck-Face-Chicks.jpg,what bronco fans do,to get tickets to the playoffs,1794,1
https://i.imgflip.com/1n91q5.jpg,Duck-Face-Chicks.jpg,duckface,gone wild,1148,1
https://i.imgflip.com/324ok9.jpg,Duck-Face-Chicks.jpg,"nothing changed, we are look like before, and  plus",we had a botox,2113,0
https://i.imgflip.com/1iu9c2.jpg,Duck-Face-Chicks.jpg,we got plastic surgey,how does it look,2199,0
https://i.imgflip.com/1fnhtw.jpg,Duck-Face-Chicks.jpg,kylie jenner,be like,1131,1
https://i.imgflip.com/1ho8s4.jpg,Duck-Face-Chicks.jpg,botox lips,matter,7361,0
https://i.imgflip.com/18anjf.jpg,Duck-Face-Chicks.jpg,wour wips are wade,wor wissing,449,2
https://i.imgflip.com/zt7x7.jpg,Duck-Face-Chicks.jpg,what your lips look like after getting,"$225,000 per hour speaking fees from wall street",727,1
https://i.imgflip.com/209abo.jpg,Duck-Face-Chicks.jpg,the literal meaning of,begone thot,2144,0
https://i.imgflip.com/z514j.jpg,Duck-Face-Chicks.jpg,"when one is in love they stop searching for new friends, old friends and messaging other girls",because if you ignore the greatness you've got and keep searching thinking it's ok you might lose the one you love and wind up with a stupid duckface hoe that's stuck on herself instead of focused on you.  real talk.,4118,0
https://i.imgflip.com/2m8ngm.jpg,Duck-Face-Chicks.jpg,damnn,dem some dsl's,1419,0
https://i.imgflip.com/4pxrfl.jpg,Duck-Face-Chicks.jpg,"the popular girls at school: ew, your ugly",also the popular girls,242,1
https://i.imgflip.com/11b76g.jpg,Duck-Face-Chicks.jpg,did kylie jenner lip challenge,didnt turn out well,1356,0
https://i.imgflip.com/1pj3rr.jpg,Duck-Face-Chicks.jpg,yes they are real,and they are spectacular,1089,1
https://i.imgflip.com/20uutq.jpg,Duck-Face-Chicks.jpg,if you think these are big,you should see the others!,1022,1
https://i.imgflip.com/1o51ao.jpg,Duck-Face-Chicks.jpg,"please, help these",ducklings find their way back home,258,1
https://i.imgflip.com/3ujws4.jpg,Duck-Face-Chicks.jpg,hoax warning,this is not a cure for cv-19,247,0
https://i.imgflip.com/2s4uh9.jpg,Duck-Face-Chicks.jpg,captain collagen's plastic surgery for seafood allergy sufferers,"beautiful, kissable lips or your money back!",879,0
https://i.imgflip.com/2qt5r9.jpg,Duck-Face-Chicks.jpg,what happens when you dont submit your time sheet,no money for the good botox,820,0
https://i.imgflip.com/2fa276.jpg,Duck-Face-Chicks.jpg,we're going to help ronnie,blow out the candles on his cake today,189,0
https://i.imgflip.com/21btxf.jpg,Duck-Face-Chicks.jpg,begone,thots,142,0
https://i.imgflip.com/2130eo.jpg,Duck-Face-Chicks.jpg,kiss these,tradeoffs,292,0
https://i.imgflip.com/1u48ji.jpg,Duck-Face-Chicks.jpg,stupid does,what stupid see's,759,0
https://i.imgflip.com/1r72aw.jpg,Duck-Face-Chicks.jpg,the only thing bigger then their lips,are their ego,341,0
https://i.imgflip.com/1olge7.jpg,Duck-Face-Chicks.jpg,hanging with my homies,and gettin crazy with the botox,570,0
https://i.imgflip.com/1ltfaj.jpg,Duck-Face-Chicks.jpg,when you drink,to much water,254,0
https://i.imgflip.com/1fllgg.jpg,Duck-Face-Chicks.jpg,say rubber baby buggy bumpers,5 times real fast,544,0
https://i.imgflip.com/187mg6.jpg,Duck-Face-Chicks.jpg,we are not talking,read the lips instead,253,0
https://i.imgflip.com/1fnde6.jpg,Duck-Face-Chicks.jpg,we were supposed to meet tarrick for lunch,could you please tag him for us?,718,0
https://i.imgflip.com/19zvyt.jpg,Duck-Face-Chicks.jpg,i think the doc injected,just a tad too much collagen,1484,0
https://i.imgflip.com/11o1xm.jpg,Duck-Face-Chicks.jpg,hi we are,dolly pardons kids,855,0
https://i.imgflip.com/zj8am.jpg,Duck-Face-Chicks.jpg,when they tried to have,kylie's lips,239,0
https://i.imgflip.com/1gfd7y.jpg,Duck-Face-Chicks.jpg,kellyanne be like,been working overtime alot,561,1
https://i.imgflip.com/1pj3w7.jpg,Duck-Face-Chicks.jpg,let me introduce the new,beat box champions of the world,313,0
https://i.imgflip.com/4hyx5f.jpg,Duck-Face-Chicks.jpg,the secret to a good haircut is ...knowing when to quit,the same is true for plastic surgery,114,0
https://i.imgflip.com/4oq6ge.jpg,Duck-Face-Chicks.jpg,if you dont upvote now,you will look like this,108,0
https://i.imgflip.com/4txwg8.jpg,Mr-Mackey.jpg,"censorship is bad, kids",mmmmkay?,638,2
https://i.imgflip.com/2f6nuf.jpg,Mr-Mackey.jpg,"""ummmâ€¦straws are bad m'kay.""",but not 4.5 million free hypodermic needles to drug addicts per year.,4600,7
https://i.imgflip.com/104xql.jpg,Mr-Mackey.jpg,um trump is bad,mmm'kay,4653,0
https://i.imgflip.com/1zrsbp.jpg,Mr-Mackey.jpg,dont do drugs mkay drugs are bad mkay,so if you do them your bad mmmkay,10206,0
https://i.imgflip.com/2qbazi.jpg,Mr-Mackey.jpg,"it's 2019, not 2018",mmmkay,3688,4
https://i.imgflip.com/1voj86.jpg,Mr-Mackey.jpg,"you shouldn't call everyone a nazi, mmkay","mm'cause then everyone will think nazis don't really exist, mmkay - and that's bad, mmkay",7539,8
https://i.imgflip.com/1zouk3.jpg,Mr-Mackey.jpg,"if everyone knows who created the meme, youâ€™re doing it wrong",mmmkay?,4221,6
https://i.imgflip.com/21b700.jpg,Mr-Mackey.jpg,being over-protective,"is bad, mmkay?",7044,6
https://i.imgflip.com/1u4ok8.jpg,Mr-Mackey.jpg,staring at the sun is bad,mmmmkay,4378,0
https://i.imgflip.com/1rxu17.jpg,Mr-Mackey.jpg,setting oreos on fire is bad,m'kay,1913,0
https://i.imgflip.com/20144w.jpg,Mr-Mackey.jpg,no pain no gain,mmkay,2995,4
https://i.imgflip.com/1tss97.jpg,Mr-Mackey.jpg,you shouldn't trade sexual favors for drugs,"m'kay, do you understand?",3694,0
https://i.imgflip.com/1rzjhp.jpg,Mr-Mackey.jpg,you're bad,m'kay,4182,0
https://i.imgflip.com/1rx4bv.jpg,Mr-Mackey.jpg,society is bad,mmkay,1036,4
https://i.imgflip.com/y36rn.jpg,Mr-Mackey.jpg,um guns are bad,mmmmkay,13151,5
https://i.imgflip.com/1j6xz0.jpg,Mr-Mackey.jpg,superman would destroy batman,that movie's just fantasy mm k,798,4
https://i.imgflip.com/1hsop8.jpg,Mr-Mackey.jpg,money is for rich people,mmmkaaayyy,991,4
https://i.imgflip.com/1kigd0.jpg,Mr-Mackey.jpg,when they tell you,it's not mmkay,730,3
https://i.imgflip.com/1coxkv.jpg,Mr-Mackey.jpg,allergies are bad,mmmkay,761,4
https://i.imgflip.com/1r9g9p.jpg,Mr-Mackey.jpg,mmmmkay....let's try to,do what i'm say.....mmmmkay,480,2
https://i.imgflip.com/1b62nk.jpg,Mr-Mackey.jpg,when i get a 87 cent soda & give you $1.02,and you can't make change,1134,2
https://i.imgflip.com/28qp87.jpg,Mr-Mackey.jpg,stop saying such stupid shit,mmmkay,565,1
https://i.imgflip.com/27ddqt.jpg,Mr-Mackey.jpg,drugs are bad m'kay,but it's important that you take your adhd meds or you can't come to school m'kay,637,1
https://i.imgflip.com/1zztxp.jpg,Mr-Mackey.jpg,tinder is bad,mmmmkay,819,2
https://i.imgflip.com/1ppn28.jpg,Mr-Mackey.jpg,scowling is bad,mmkay,1315,1
https://i.imgflip.com/1kp0e2.jpg,Mr-Mackey.jpg,maybe donald trump is just jealous of china that he wants his own great wall,mmmkayy,293,3
https://i.imgflip.com/421tr8.jpg,Mr-Mackey.jpg,what? giraffes can go less than a week without food,but ticks can go 2 years without food? mmm'kay...,179,15
https://i.imgflip.com/22i02x.jpg,Mr-Mackey.jpg,clear your cache,mmkay,1077,1
https://i.imgflip.com/22lv5e.jpg,Mr-Mackey.jpg,this place is a,shithole mmmkay,532,1
https://i.imgflip.com/42svog.jpg,Mr-Mackey.jpg,inferred rays are bad,mmmmmkay,123,0
https://i.imgflip.com/3yidwy.jpg,Mr-Mackey.jpg,is every other day garbage day,or does it just seem like it?,104,0
https://i.imgflip.com/3tqfmq.jpg,Mr-Mackey.jpg,stay at home,mmkay,178,0
https://i.imgflip.com/2weoi6.jpg,Mr-Mackey.jpg,fortnites bauyd,m'kay?,958,0
https://i.imgflip.com/2rb25y.jpg,Mr-Mackey.jpg,drug shortages are,"bad, mmmkay",671,0
https://i.imgflip.com/2bnywx.jpg,Mr-Mackey.jpg,expectations are bad,mkay,222,0
https://i.imgflip.com/230wrx.jpg,Mr-Mackey.jpg,ajit pai,"is bad, mkay",249,0
https://i.imgflip.com/1kjz5z.jpg,Mr-Mackey.jpg,you're the king of stereotypes,m'kay??,201,0
https://i.imgflip.com/1i9ivq.jpg,Mr-Mackey.jpg,nazi punching is bad,mmmmmkay,309,0
https://i.imgflip.com/1amk4n.jpg,Mr-Mackey.jpg,swallowing,is good mmm'kay,286,0
https://i.imgflip.com/1edwf4.jpg,Mr-Mackey.jpg,oh my gosh,ngaahule,220,0
https://i.imgflip.com/24xjbk.jpg,Mr-Mackey.jpg,"isis islamic state isil/is daesh, al qaeda, islam and muslims in europe","the sami or saami (laplander) people of sweden, finland, norway, russia and arctic circle, scandinavia (lapland - sampi region) and northern europe",305,0
https://i.imgflip.com/22lv8m.jpg,Mr-Mackey.jpg,shithole,mmkay,256,0
https://i.imgflip.com/2g55k5.jpg,Mr-Mackey.jpg,union thugs rock,mmkay!,852,0
https://i.imgflip.com/5q76et.jpg,Thats-my-secret.jpg,"that's my secret, cap",it's always oc,1202,6
https://i.imgflip.com/3xvyv4.jpg,Thats-my-secret.jpg,thats our secret,were always miserable,6207,5
https://i.imgflip.com/1youob.jpg,Thats-my-secret.jpg,that's my secret,i' m a bad memer,3021,0
https://i.imgflip.com/112ei3.jpg,Thats-my-secret.jpg,that's my secret,i have the 'don't show me posts i've downvoted' option enabled,1970,2
https://i.imgflip.com/4znoox.jpg,Thats-my-secret.jpg,new york city postcard,"come to new york where you can do whatever you want well except, eat, drink, shop, workout, have fun...etc but hey you can loot and burn shit down",443,0
https://i.imgflip.com/242r2p.jpg,Thats-my-secret.jpg,siempre estoy oxidado en analisis,ese es mi secreto,682,0
https://i.imgflip.com/657b8w.jpg,Sad-Spiderman.jpg,when it's valentine's day and,you realize you will never get any bitches,118,1
https://i.imgflip.com/653hk2.jpg,Sad-Spiderman.jpg,"your mom: honey i""m not mad i'm just disappointed",you:,60,1
https://i.imgflip.com/5z2lkh.jpg,Sad-Spiderman.jpg,when you find out the toy you bought requires three batteries,but you only purchased two.,439,4
https://i.imgflip.com/5y8vpm.jpg,Sad-Spiderman.jpg,spider man:,no home,499,4
https://i.imgflip.com/5xgp5s.jpg,Sad-Spiderman.jpg,"when a upvote beggar gets 1,00 upvotes",and you make a good meme and get 20,411,0
https://i.imgflip.com/5dm3wu.jpg,Sad-Spiderman.jpg,my uh auntie's christen baby has past away because of cancer,let's get up to 1000 up vote's for her loss plz and thank you,969,0
https://i.imgflip.com/2mddp3.jpg,Sad-Spiderman.jpg,spider-man just heard,his creator has passed away,22066,0
https://i.imgflip.com/5ddyir.jpg,Sad-Spiderman.jpg,if people would stop using wrong memes templates,that would be great,786,0
https://i.imgflip.com/5nxj60.jpg,Sad-Spiderman.jpg,it's too much,i need a break,440,2
https://i.imgflip.com/4wl71p.jpg,Sad-Spiderman.jpg,when you died because you,actually had your semi auto weapon equipped,916,6
https://i.imgflip.com/4wa544.jpg,Sad-Spiderman.jpg,spiderman watches a youtube video of spiders feeding,"""i could have picked super dude, maybe awesome man.  why did i pick a gross spider?""",936,4
https://i.imgflip.com/4k2mji.jpg,Sad-Spiderman.jpg,convenience store,workers,1197,6
https://i.imgflip.com/4pvicu.jpg,Sad-Spiderman.jpg,safety training: do not hang out of windows  site manager: do not hang out of windows where people can see you  superviser: take your boots off before you stand on that window sill,me,1052,5
https://i.imgflip.com/42b70d.jpg,Sad-Spiderman.jpg,did that idiot wal-mart greeter,seriously just stop me from entering because i'm not wearing a mask?,1776,0
https://i.imgflip.com/4a57hr.jpg,Sad-Spiderman.jpg,oh ****,homework is due today,1470,0
https://i.imgflip.com/2hzst1.jpg,Sad-Spiderman.jpg,my girlfriend dumped me,because she hates spiders,5954,0
https://i.imgflip.com/4npf73.jpg,Sad-Spiderman.jpg,when you over practiced before a recording session,and your teacher starts pointing out mistakes,673,2
https://i.imgflip.com/2g4xvi.jpg,Sad-Spiderman.jpg,deadpool is very popular,is there no hope for this world??,2849,0
https://i.imgflip.com/44jrv9.jpg,Sad-Spiderman.jpg,say fword during online class,forgot to turn off the mic,1231,4
https://i.imgflip.com/4hfolt.jpg,Sad-Spiderman.jpg,just wish the old days,where people did not tell others to hate on something,597,2
https://i.imgflip.com/2vee0m.jpg,Sad-Spiderman.jpg,spider-man,just watched infinity war,4708,8
https://i.imgflip.com/118mbr.jpg,Sad-Spiderman.jpg,i've been unmasked in my last 4 films,why do i even bother dressing up?,16759,0
https://i.imgflip.com/2ohkcm.jpg,Sad-Spiderman.jpg,when you write something remotely good,and then you accidentally delete it,2095,0
https://i.imgflip.com/2mivdf.jpg,Sad-Spiderman.jpg,stan lee,1922-2018,1666,0
https://i.imgflip.com/2g56l4.jpg,Sad-Spiderman.jpg,when you wake up,and youâ€™re still alive,1420,0
https://i.imgflip.com/38tup5.jpg,Sad-Spiderman.jpg,thanks a lot disney & sony,because of you two arguing youâ€™re making spiderman cry,1932,4
https://i.imgflip.com/2yetii.jpg,Sad-Spiderman.jpg,tfw you realize the western comic book industry is going through,its worst slump since the late 1980s-mid 1990s.,2086,5
https://i.imgflip.com/2hjx21.jpg,Sad-Spiderman.jpg,got an illusion of doing something meaningful,by completing tasks in video game,2744,0
https://i.imgflip.com/2eb4s8.jpg,Sad-Spiderman.jpg,my words are like my webs,i keep getting all tangled up every time i spin,1082,0
https://i.imgflip.com/1rj33j.jpg,Sad-Spiderman.jpg,"beyonce has been ""dangerously in love"", ""crazy in love"", and ""drunk in love""",yet i haven't had a single girlfriend,3667,11
https://i.imgflip.com/17zaaw.jpg,Sad-Spiderman.jpg,that moment when you realize,you don't like your favorite show any more,1518,12
https://i.imgflip.com/2zdfrw.jpg,Sad-Spiderman.jpg,when you tell your friend secretly about a movie website that you only wanted him o know,and then the next day nearly everyone in class on a laptop is on it.,838,4
https://i.imgflip.com/2iahx9.jpg,Sad-Spiderman.jpg,this is xbox fans when they look at the new spiderman,and cant play it,1393,4
https://i.imgflip.com/1kee5h.jpg,Sad-Spiderman.jpg,i've been bitten by a spider a dozen times since 1962,i'm 70 years old. when will it stop?,1956,0
https://i.imgflip.com/2vqgps.jpg,Sad-Spiderman.jpg,when u can't find any,internet at the pub,790,3
https://i.imgflip.com/1z3kx1.jpg,Sad-Spiderman.jpg,when u dont know what u be doing and u be like,......why?,994,6
https://i.imgflip.com/22jdux.jpg,Sad-Spiderman.jpg,i lost my phone,and it was on silent...,1527,0
https://i.imgflip.com/2s3yx2.jpg,Sad-Spiderman.jpg,i died in infinity war,and people still sell my merchandise,746,3
https://i.imgflip.com/2kkk3c.jpg,Sad-Spiderman.jpg,i missed it,i missed jojo friday,30928,2
https://i.imgflip.com/20rb33.jpg,Sad-Spiderman.jpg,how you feel,when she won't let you shoot your web,2786,5
https://i.imgflip.com/2xj21o.jpg,Sad-Spiderman.jpg,that moment you realize,that you will never do anything that will get you famous,402,1
https://i.imgflip.com/1sf1j0.jpg,Sad-Spiderman.jpg,joined 15 dank meme groups on facebook,i've seen all the memes,9152,0
https://i.imgflip.com/1vgmev.jpg,Sad-Spiderman.jpg,with great power,comes great clichÃ©s,2274,0
https://i.imgflip.com/29ay3w.jpg,Sad-Spiderman.jpg,when you told mr stark,you dont wanna go,3257,3
https://i.imgflip.com/1p2nds.jpg,Sad-Spiderman.jpg,the audience doesn't care,they keep changing the actor for me,1068,0
https://i.imgflip.com/20renx.jpg,Sad-Spiderman.jpg,how you feel,when you shoot your web too soon,6172,4
https://i.imgflip.com/1rz3vc.jpg,Sad-Spiderman.jpg,i really hope,they get this one right,748,0
https://i.imgflip.com/29v72q.jpg,Sad-Spiderman.jpg,finally gets crowned: avenger,dies on the same day,809,3
https://i.imgflip.com/1vxmsx.jpg,Sad-Spiderman.jpg,did we have any homework,"no, we stopped class to mourn your absents",6869,0
https://i.imgflip.com/2mk3vt.jpg,Sad-Spiderman.jpg,sssssssssssssss,ad man,806,2
https://i.imgflip.com/1y4ayg.jpg,Sad-Spiderman.jpg,when you're trying to teach a girl that,how to download movies from torrent,1041,0
https://i.imgflip.com/17fa66.jpg,Sad-Spiderman.jpg,if you plan to vote for trump,please unfriend me now,3898,0
https://i.imgflip.com/ydwdy.jpg,Sad-Spiderman.jpg,the moment you realize,spiderman is just a pg-13 deadpool,5090,5
https://i.imgflip.com/1ogkih.jpg,Sad-Spiderman.jpg,when u realize u just sent that,"brake-up text message to ur gf, but u accidentally sent it to ur wife",1292,0
https://i.imgflip.com/zxa2x.jpg,Sad-Spiderman.jpg,how can anybody choose,team captain america?,1476,6
https://i.imgflip.com/2nd2l5.jpg,Sad-Spiderman.jpg,when you don't chase,shocker to the ends of the earth,2287,1
https://i.imgflip.com/2x7isu.jpg,Sad-Spiderman.jpg,when you realize that,sjw pinkos have compromised marvel comics,961,1
https://i.imgflip.com/y37oh.jpg,Sad-Spiderman.jpg,i tried to play star wars battlefront,but i got owned by the rgf,1717,4
https://i.imgflip.com/1gurgk.jpg,Sad-Spiderman.jpg,was broke when the year begin,still broke as it ends,1152,3
https://i.imgflip.com/2vool7.jpg,Sad-Spiderman.jpg,when they say,"""leave it for the bomb squad""",712,1
https://i.imgflip.com/20ju58.jpg,Sad-Spiderman.jpg,why life why,must you do this to me?,570,2
https://i.imgflip.com/11zdpl.jpg,Sad-Spiderman.jpg,when i hear the words,"""girl drama""",1630,0
https://i.imgflip.com/2p0cux.jpg,Sad-Spiderman.jpg,when i get up,monday,212,3
https://i.imgflip.com/15fs97.jpg,Sad-Spiderman.jpg,"its a sad day ,kimbo slice is dead before i could cast him as my sidekick",spiderman and the slice,2883,0
https://i.imgflip.com/24x34b.jpg,Sad-Spiderman.jpg,i don't know why i did that,sorry    kate,1703,1
https://i.imgflip.com/zicnm.jpg,Sad-Spiderman.jpg,i have a funny meme idea with alpacas,but the isn't a featured alpaca meme yet,7277,0
https://i.imgflip.com/113uve.jpg,Sad-Spiderman.jpg,u lose ur goggles every week,but u never forget to ask me for an allowance.,860,0
https://i.imgflip.com/296lzj.jpg,Sad-Spiderman.jpg,when you feel melancholy,that you just want to give up,1049,1
https://i.imgflip.com/3va8xg.jpg,Sad-Spiderman.jpg,when you realize,homework is due today,133,0
https://i.imgflip.com/17aw83.jpg,Sad-Spiderman.jpg,i can't believe don,thought he could move like me.,1229,2
https://i.imgflip.com/265nxr.jpg,Sad-Spiderman.jpg,me,when someone says that the epl race is still open,964,6
https://i.imgflip.com/10c021.jpg,Sad-Spiderman.jpg,"xmen, spiderman, now dead pool",please don't harm anymore of our childhood memories,776,2
https://i.imgflip.com/30wadm.jpg,Sad-Spiderman.jpg,when you come early to the comic book store,and amazing spider-man #1 is sold out,1384,0
https://i.imgflip.com/ynit1.jpg,Sad-Spiderman.jpg,why deadpool,is 3 times powerful than me?,2427,0
https://i.imgflip.com/1gc8ct.jpg,Sad-Spiderman.jpg,roses are red my a-- is in heaven,because it got kicked by the legend27,1583,1
https://i.imgflip.com/1fp8wt.jpg,Sad-Spiderman.jpg,picks axe,doesn't stack the jungle,782,1
https://i.imgflip.com/11a5c4.jpg,Sad-Spiderman.jpg,when you finally get in the mcu,but in the middle of a civil war,1098,1
https://i.imgflip.com/11to2u.jpg,Sad-Spiderman.jpg,how i feel when you ask me the same question that i,just spent 10 minutes explaining!,1004,2
https://i.imgflip.com/zf43n.jpg,Sad-Spiderman.jpg,my girlfriend,broke up with me when she found out who i really was,596,1
https://i.imgflip.com/19ydl7.jpg,Sad-Spiderman.jpg,saving the world doesn't mean anything,if your voting for trump,571,0
https://i.imgflip.com/1zdx4h.jpg,Sad-Spiderman.jpg,hey,im sorry,1047,0
https://i.imgflip.com/1ph0kt.jpg,Sad-Spiderman.jpg,when a parent says,"their not mad, just disappointed",643,2
https://i.imgflip.com/2jajmh.jpg,Sad-Spiderman.jpg,"while teching my bro to operate computer and the scree show ""press any key"" so he press power off button",@memehub111,258,1
https://i.imgflip.com/1kryja.jpg,Sad-Spiderman.jpg,"that depressing feeling, when you went to shit and thought you had delivered a mountain",but found it was only a molehill.,378,2
https://i.imgflip.com/18elhs.jpg,Sad-Spiderman.jpg,when you realize,that it's august and school starts in a few weeks...,673,1
https://i.imgflip.com/5z9uc1.jpg,Sad-Spiderman.jpg,when you get super stoked for the football game,but your team doesn't get a single point.,78,0
https://i.imgflip.com/3rtcgz.jpg,Sad-Spiderman.jpg,me when someone says that batman,is their favourite marvel hero,442,0
https://i.imgflip.com/2y530i.jpg,Sad-Spiderman.jpg,when you realize that,you shouldn't have gotten a new spider suit,548,0
https://i.imgflip.com/2nh92m.jpg,Sad-Spiderman.jpg,saves the city,still making minimum wage!,404,0
https://i.imgflip.com/2g4rq0.jpg,Sad-Spiderman.jpg,the royals is  cancelled,and i'm very sad about it but there is hope,181,0
https://i.imgflip.com/23yjl6.jpg,Sad-Spiderman.jpg,how you feel,when you have no robux..,584,0
https://i.imgflip.com/1vteod.jpg,Sad-Spiderman.jpg,i always get so comfortable laying on my chair and looking at imgflip front page memes,"then i scroll all the way down and i have to get up, reach for the mouse, and click next",501,0
https://i.imgflip.com/1uuga7.jpg,Sad-Spiderman.jpg,when people ask you what you're,doing with your life.,242,0
https://i.imgflip.com/1obnoy.jpg,Sad-Spiderman.jpg,when your day's been crap,and you're waiting for a phone call that's going to make it worse,324,0
https://i.imgflip.com/zdjla.jpg,Sad-Spiderman.jpg,i want,my mummy?,413,0
https://i.imgflip.com/19yzqq.jpg,Sad-Spiderman.jpg,my poor pal ethan,get well soon,1726,0
https://i.imgflip.com/22o3uk.jpg,Sad-Spiderman.jpg,now theres imgflip pro,that i cant afford :{,128,0
https://i.imgflip.com/2707kd.jpg,Sad-Spiderman.jpg,why,i i didn't finish school,640,0
https://i.imgflip.com/2ax0lt.jpg,Sad-Spiderman.jpg,because,mobile is the future,121,0
https://i.imgflip.com/2gihdx.jpg,Sad-Spiderman.jpg,when you submitted a meme,that you didn't want to be submitted,123,0
https://i.imgflip.com/2meeqg.jpg,Sad-Spiderman.jpg,stan lee,rip,203,0
https://i.imgflip.com/3067cl.jpg,Sad-Spiderman.jpg,i'm sad you died mr. stark,now who's gonna make my suits?!!!,251,0
https://i.imgflip.com/4qidvi.jpg,Sad-Spiderman.jpg,when you learn among us,isn't free on switch,102,0
https://i.imgflip.com/5aplhw.jpg,Sad-Spiderman.jpg,me: iâ€™m gonna hang up now,kid named up:,91,0
https://i.imgflip.com/61mwln.jpg,Dumb-Blonde.jpg,my last pregnancy test took,10 months to get results,335,0
https://i.imgflip.com/5u8md7.jpg,Dumb-Blonde.jpg,i turned my water heater up to 130 degrees,but the water coming out of my fridge is still freezing,416,6
https://i.imgflip.com/5uwilo.jpg,Dumb-Blonde.jpg,i accidentally dropped some rice into some water,"so, i put in a bag of cell phones to dry the rice out.",687,9
https://i.imgflip.com/5yo1w3.jpg,Dumb-Blonde.jpg,i once saw a ufo,it was white with blinking lights and it looked like it was landing at the regional airport,181,1
https://i.imgflip.com/5h75ac.jpg,Dumb-Blonde.jpg,the summer uv index is really low,at night,509,0
https://i.imgflip.com/2nrkof.jpg,Dumb-Blonde.jpg,mars landing? i already watched a documentary about it,when matt damon got stranded there,24879,0
https://i.imgflip.com/2hzle1.jpg,Dumb-Blonde.jpg,i put the baby on the baby changing station,but nothing happened!,19857,0
https://i.imgflip.com/377z7v.jpg,Dumb-Blonde.jpg,i put my phone on airplane mode and it didn't fly,i demand a refund,10163,0
https://i.imgflip.com/52vbwa.jpg,Dumb-Blonde.jpg,i was so disappointed the last time i ate at hooters,i looked everywhere and there was not a single owl in the place,4309,6
https://i.imgflip.com/50fk9s.jpg,Dumb-Blonde.jpg,my bf said if i eat his nuts it would give me all of my protiens,"even though im allergic, i ate them anyway, turns out i ate the wrong ones and i almost died lol.",733,7
https://i.imgflip.com/270tjb.jpg,Dumb-Blonde.jpg,i'm gonna sell my vacuum cleaner,all it's doing is gathering dust,6503,0
https://i.imgflip.com/3tms3v.jpg,Dumb-Blonde.jpg,does anyone know how long toilet paper will last,if you freeze it?,5917,0
https://i.imgflip.com/2vozmu.jpg,Dumb-Blonde.jpg,this form asks for my mom's maiden name,but she doesn't have one because she was never a maid,4814,0
https://i.imgflip.com/2v1cdo.jpg,Dumb-Blonde.jpg,i bought a bird-dog,it doesn't fly at all,4108,0
https://i.imgflip.com/4iamrt.jpg,Dumb-Blonde.jpg,i don't know why it's so hard to make a meme,prayers always end the same way,1036,0
https://i.imgflip.com/2c71jp.jpg,Dumb-Blonde.jpg,i already have a terrestrial,why would i need an extra terrestrial?,2764,0
https://i.imgflip.com/2ggb94.jpg,Dumb-Blonde.jpg,my stupid husband keeps saying we need to buy,"a computer to surf the web but, neither of us knows how to swim",2014,0
https://i.imgflip.com/37hjkp.jpg,Dumb-Blonde.jpg,who was phillip,and why does he have a screwdriver named after him?,3098,0
https://i.imgflip.com/4kb3ma.jpg,Dumb-Blonde.jpg,i keep seeing all these commercials  for people with dysfunctional reptiles,2020,706,0
https://i.imgflip.com/2lcmp7.jpg,Dumb-Blonde.jpg,guys are so polite,"when they see a girl 97% naked in a bikini, they only look at the covered parts",3324,0
https://i.imgflip.com/2wgpi5.jpg,Dumb-Blonde.jpg,my boss told me to have a good day,so i went home,1828,0
https://i.imgflip.com/37ct4m.jpg,Dumb-Blonde.jpg,digiorno says it's just like delivery,i put it in my oven but my doorbell never rang,3776,0
