url,filename,uppercaption,lowercaption,views,upvote
https://i.imgflip.com/1xgxlk.jpg,Take-A-Seat-Cat.jpg,take at seat and explain to me,why i have to poop in a bowl of brown rocks?,3884,0
https://i.imgflip.com/4di0wr.jpg,Take-A-Seat-Cat.jpg,have a seat,and explain why you named me bob,853,4
https://i.imgflip.com/4kazwa.jpg,Take-A-Seat-Cat.jpg,hello mother,lets talk about how you ate all the chocolate,897,3
https://i.imgflip.com/184djm.jpg,Take-A-Seat-Cat.jpg,we have to talk about the human,he keeps stealing my poop,6578,0
https://i.imgflip.com/4h4hq7.jpg,Take-A-Seat-Cat.jpg,so your a mexican hairless,we gotta cleaning position open,878,4
https://i.imgflip.com/2fx1ud.jpg,Take-A-Seat-Cat.jpg,take a seat tom,after all these years of not being able to catch jerry i hereby inform you that your services are no longer required,2532,0
https://i.imgflip.com/2bhalh.jpg,Take-A-Seat-Cat.jpg,could you explain to me,why clever memes dont get any love?,1424,0
https://i.imgflip.com/39m123.jpg,Take-A-Seat-Cat.jpg,take a seat,i pooped on it,1830,0
https://i.imgflip.com/3cm0qu.jpg,Take-A-Seat-Cat.jpg,take a seat,i'll tell about what happened to my social life,584,2
https://i.imgflip.com/1a7k5r.jpg,Take-A-Seat-Cat.jpg,take a seat,"first off, the pop rocks in my litter box, was not funny",2334,0
https://i.imgflip.com/4hmy8x.jpg,Take-A-Seat-Cat.jpg,take a seat kid i have a story,it's about how lucky you were to have a good time in school compared to most of us,642,0
https://i.imgflip.com/2zpxis.jpg,Take-A-Seat-Cat.jpg,we need to talk,why would you say t-series is better,1227,6
https://i.imgflip.com/2bql58.jpg,Take-A-Seat-Cat.jpg,let me tell you a bedtime story,"once upon a time, theres a dead rat under your pillow",1768,10
https://i.imgflip.com/39sozb.jpg,Take-A-Seat-Cat.jpg,parents: we need to talk,me: what did i do wrong????,2216,4
https://i.imgflip.com/3bkpu2.jpg,Take-A-Seat-Cat.jpg,we need to have a talk human,why you are stealing my poop from the box,1242,4
https://i.imgflip.com/y32y8.jpg,Take-A-Seat-Cat.jpg,"school is cancelled tommorow, but my parents still want me to finish my history paper",i've never understood common sense,4930,0
https://i.imgflip.com/1md22v.jpg,Take-A-Seat-Cat.jpg,when you look through his phone,awaiting his arrival home for questioning,1658,0
https://i.imgflip.com/1c1rz9.jpg,Take-A-Seat-Cat.jpg,i want you all,"to share your thoughts and opinions on me, what am i to you? answer in the comments",1138,0
https://i.imgflip.com/2yghui.jpg,Take-A-Seat-Cat.jpg,take a seat,and explain why this meme is dead,710,5
https://i.imgflip.com/14xnk7.jpg,Take-A-Seat-Cat.jpg,i miss the days of some evil doctor trying to take over the world,now they're all just a bunch of pill pushers,2574,0
https://i.imgflip.com/1cn9li.jpg,Take-A-Seat-Cat.jpg,your quarterly review doesn't look like it's going to be pleasant for either of us,"i've noticed a 20% decrease in petting, failure to replace scratching posts in a timely fashion, and you bought a puppy",1676,0
https://i.imgflip.com/2igh48.jpg,Take-A-Seat-Cat.jpg,"gotta go sprint at 400mph into a random, room, and brake expensive silverware",for no reason at all.,686,0
https://i.imgflip.com/2rebvu.jpg,Take-A-Seat-Cat.jpg,donâ€™t make me  use force,where are the kitty treats?,1214,4
https://i.imgflip.com/2g0s8m.jpg,Take-A-Seat-Cat.jpg,we need to talk,this bath thing- it just isnâ€™t working out,947,0
https://i.imgflip.com/1bi4h5.jpg,Take-A-Seat-Cat.jpg,i admit hillary won the first debate,but i have never been able to shake off being called deplorable for not being in lockstep with the liberal agenda,1756,0
https://i.imgflip.com/1jgrr0.jpg,Take-A-Seat-Cat.jpg,im going to spend my valentine's day with my ex,box 360,1824,10
https://i.imgflip.com/497ri1.jpg,Take-A-Seat-Cat.jpg,ili: checkmate,anybody: so what game are we playi...oh...,121,1
https://i.imgflip.com/2ow1rs.jpg,Take-A-Seat-Cat.jpg,we need to talk,why didn't you buy me treats,935,4
https://i.imgflip.com/1a8dut.jpg,Take-A-Seat-Cat.jpg,dogs can't run mri machines,but catscan,6412,10
https://i.imgflip.com/1xzt4z.jpg,Take-A-Seat-Cat.jpg,"no one ever says, ""i want to be chinese food when i grow up.""",teach your kids about the dangers of catnip.,5916,6
https://i.imgflip.com/1skc59.jpg,Take-A-Seat-Cat.jpg,try to understand the distress you're causing the other cats around here,if you don't quit eating the poop out of our litter boxes we will be forced to hire another token dog to fill your position,1143,0
https://i.imgflip.com/1op1xn.jpg,Take-A-Seat-Cat.jpg,my cat,when i'm late with her breakfast.,1774,0
https://i.imgflip.com/16ilt5.jpg,Take-A-Seat-Cat.jpg,"mom and dad, take a seat",i'm not seeing a resemblance between us. am i adopted?,1200,0
https://i.imgflip.com/1abb24.jpg,Take-A-Seat-Cat.jpg,when i'm about to step outside to have a smoke,and then remember that i quit smoking,3784,0
https://i.imgflip.com/1dn20p.jpg,Take-A-Seat-Cat.jpg,thanksgiving is coming,let's talk turkey,3480,8
https://i.imgflip.com/16kgdy.jpg,Take-A-Seat-Cat.jpg,looks like the police are trying a  new tactic,intimidation by cuteness,1848,0
https://i.imgflip.com/1kttv3.jpg,Take-A-Seat-Cat.jpg,i have talked to the union,the catnip clause is non-negotiable,2160,6
https://i.imgflip.com/17tdzb.jpg,Take-A-Seat-Cat.jpg,we only have 1 life,we just manage it better,545,9
https://i.imgflip.com/137c4e.jpg,Take-A-Seat-Cat.jpg,my life is a rollercoaster,"that falls off the rails into a lake of rusty cheese graters, slowly killing me while onlookers blast justin bieber",4759,10
https://i.imgflip.com/1iqyg6.jpg,Take-A-Seat-Cat.jpg,please take a seat,and explain where is everybody,1253,0
https://i.imgflip.com/16xla1.jpg,Take-A-Seat-Cat.jpg,one of the hardest things about having narcissistic people in your life is that,"they will always mean much, much more to you than you will ever mean to them. simply because you're capable of that, and they're not.",1366,0
https://i.imgflip.com/16m324.jpg,Take-A-Seat-Cat.jpg,"boris, i am afraid you did not pass your background check","you think we wouldn't find out about the arrests for catnip possession, aggravated assault of neighbor's cat and public urination ?",2860,8
https://i.imgflip.com/1xodf9.jpg,Take-A-Seat-Cat.jpg,my contract clearly states,that i have the right to sit on your face at 3 am,1370,0
https://i.imgflip.com/1pzdbo.jpg,Take-A-Seat-Cat.jpg,boi why are you in jail,what! you were the one who took my tuna!!!!! go back in jail,1177,5
https://i.imgflip.com/1wembd.jpg,Take-A-Seat-Cat.jpg,take a seat,explain me why you hate getting cat scans?,603,0
https://i.imgflip.com/2ahbqh.jpg,Take-A-Seat-Cat.jpg,i did the math,we cannot afford the dog,702,4
https://i.imgflip.com/1y3u1x.jpg,Take-A-Seat-Cat.jpg,can one of you tell me,who stole my testicles?,748,4
https://i.imgflip.com/17ru8j.jpg,Take-A-Seat-Cat.jpg,telling a woman to calm down,works about as well as baptizing me,4044,6
https://i.imgflip.com/2947v9.jpg,Take-A-Seat-Cat.jpg,please have a seat,and explain why you've been burgling my turdhouse,535,3
https://i.imgflip.com/1jmcg1.jpg,Take-A-Seat-Cat.jpg,please take a seat,and explain why i have not been fed in the past 20 seconds,2233,0
https://i.imgflip.com/yxal5.jpg,Take-A-Seat-Cat.jpg,take a seat,the tv broke for no reason,2896,6
https://i.imgflip.com/1nrr0w.jpg,Take-A-Seat-Cat.jpg,i pleased to inform you that your hired for the management position,"now before you start to climb the corporate ladder, you need to start at the bottom. my litter box is in the hall closet.",1284,5
https://i.imgflip.com/1865cd.jpg,Take-A-Seat-Cat.jpg,we must talk about the catnip,it's made the others mad,407,0
https://i.imgflip.com/19ty1b.jpg,Take-A-Seat-Cat.jpg,hillary clinton is mediocrity descending into chaos,if there was only something i could do about it. but i am only a cat.  sigh.,674,7
https://i.imgflip.com/18ewnf.jpg,Take-A-Seat-Cat.jpg,"please, take a seat",while i tell you about everything you're doing wrong,1362,5
https://i.imgflip.com/1sp698.jpg,Take-A-Seat-Cat.jpg,"""take a seat cat""","wha, what we dealin' now? herrrrrroin? marrrrrijuana?",772,0
https://i.imgflip.com/39qfu6.jpg,Take-A-Seat-Cat.jpg,we need to discuss the situation with the missing mouse,i ate it and iâ€™m not sorry,714,1
https://i.imgflip.com/zdie7.jpg,Take-A-Seat-Cat.jpg,bob we need to talk,i need more nip,730,0
https://i.imgflip.com/294qwv.jpg,Take-A-Seat-Cat.jpg,i've called you here today to,fully define how wonderful you are!,1989,2
https://i.imgflip.com/1zi8n9.jpg,Take-A-Seat-Cat.jpg,"take a seat,tell me",where did you put the dog food?,477,0
https://i.imgflip.com/1b5jqj.jpg,Take-A-Seat-Cat.jpg,it does not appear,that that dog was injured,390,0
https://i.imgflip.com/1df1u6.jpg,Take-A-Seat-Cat.jpg,trump oh trump,we need to talk,380,5
https://i.imgflip.com/10e99k.jpg,Take-A-Seat-Cat.jpg,try wearing less make-up when you leave the house,even if it means angering the other members of kiss,848,5
https://i.imgflip.com/yfoce.jpg,Take-A-Seat-Cat.jpg,when you want to make a meme,but you suck at making them,1227,5
https://i.imgflip.com/1m0wb9.jpg,Take-A-Seat-Cat.jpg,ok kittens i will ask one meow time,who pinched my catnip??,576,0
https://i.imgflip.com/14qda7.jpg,Take-A-Seat-Cat.jpg,happy birthday daisy,now where is the birthday cake???,2247,4
https://i.imgflip.com/1o97ky.jpg,Take-A-Seat-Cat.jpg,pets be like,about that food bowl...let's try this again.,459,3
https://i.imgflip.com/1jvpk7.jpg,Take-A-Seat-Cat.jpg,"chief, we need to talk: i'm gonna need a raise",my wife just bore me ten sons today,1295,4
https://i.imgflip.com/12hlla.jpg,Take-A-Seat-Cat.jpg,no. i don't understand,why my show can't be on everyday.,1731,5
https://i.imgflip.com/21a4fa.jpg,Take-A-Seat-Cat.jpg,tell me again...why you used my fabric scissors,for cutting cardboard,1201,2
https://i.imgflip.com/1iqkig.jpg,Take-A-Seat-Cat.jpg,take a seat,and explain why did you had to spoil the story,188,3
https://i.imgflip.com/12f104.jpg,Take-A-Seat-Cat.jpg,now...i'm going to count to three,and the catnip better be on the table when i get to 3,914,5
https://i.imgflip.com/12d15t.jpg,Take-A-Seat-Cat.jpg,please sit down there's something you need to know,i now own the house. you have until friday to get out.,796,4
https://i.imgflip.com/20r1bj.jpg,Take-A-Seat-Cat.jpg,your going to have to explain this to me,what do you mean its not a real mouse explain,663,2
https://i.imgflip.com/2doz3s.jpg,Take-A-Seat-Cat.jpg,i have to tell you some bad news,i'm afraid it is cat-astrophic. maynard modern media,1549,0
https://i.imgflip.com/178yci.jpg,Take-A-Seat-Cat.jpg,so the dog ate all my poop,then licked me in the face,1075,0
https://i.imgflip.com/1768s1.jpg,Take-A-Seat-Cat.jpg,when you see your brother's posts but won't like or comment,because you discovered he passed through town and didn't visit,569,0
https://i.imgflip.com/13zudz.jpg,Take-A-Seat-Cat.jpg,"alright, alright! i did the parakeet","you get a full confession, i get a month of dry food, no catnip",925,3
https://i.imgflip.com/1gv7kp.jpg,Take-A-Seat-Cat.jpg,sometimes my cat looks at me like,get your shit together,2474,2
https://i.imgflip.com/1lpl5j.jpg,Take-A-Seat-Cat.jpg,i know i've asked you 100 times and i'll ask you 100 more,where are you hiding my poop!!!,1566,2
https://i.imgflip.com/1ip01m.jpg,Take-A-Seat-Cat.jpg,why don't you have a seat and grab a book,and turn to page 394,296,0
https://i.imgflip.com/ytf97.jpg,Take-A-Seat-Cat.jpg,i went outside once,the graphics were great but the storyline was awful. don't even get me started on the lags.,1609,3
https://i.imgflip.com/255xql.jpg,Take-A-Seat-Cat.jpg,okay dad hurry up im playing fortnite,go get the belt,2229,1
https://i.imgflip.com/1aac6k.jpg,Take-A-Seat-Cat.jpg,take a seat,and keep it,245,0
https://i.imgflip.com/z0mre.jpg,Take-A-Seat-Cat.jpg,the dog must leave,"actually, you all should leave",562,3
https://i.imgflip.com/19spey.jpg,Take-A-Seat-Cat.jpg,crypto cat,let us negotiate the return of your files,2711,2
https://i.imgflip.com/25ken5.jpg,Take-A-Seat-Cat.jpg,"when nobody gets, that youâ€˜re an animagus",because youâ€˜re playing the cat role perfectly,483,0
https://i.imgflip.com/186rtx.jpg,Take-A-Seat-Cat.jpg,thank you for coming today,"lets talk business, the catnip?",2612,3
https://i.imgflip.com/1ga55c.jpg,Take-A-Seat-Cat.jpg,if you can pay me,take a seat,863,2
https://i.imgflip.com/17eo8m.jpg,Take-A-Seat-Cat.jpg,"hi human, have a seat",why did i hear you saying dogs are better than cats,20938,1
https://i.imgflip.com/18vg0s.jpg,Take-A-Seat-Cat.jpg,i don't upvote,pics of animals in clothes,278,0
https://i.imgflip.com/2947l6.jpg,Take-A-Seat-Cat.jpg,please have a seat,and roll for initiative alrady,1175,1
https://i.imgflip.com/2bicxb.jpg,Take-A-Seat-Cat.jpg,cats donâ€™t even need to be trained,to make you change the litterbox,167,2
https://i.imgflip.com/23a9tj.jpg,Take-A-Seat-Cat.jpg,hello human we have to discus,the kind of fish you give me,1535,1
https://i.imgflip.com/2avths.jpg,Take-A-Seat-Cat.jpg,i'm part of a mass media so i am like,a big deal around here,308,1
https://i.imgflip.com/2947rq.jpg,Take-A-Seat-Cat.jpg,please have a seat,you look tired,240,1
https://i.imgflip.com/2947q4.jpg,Take-A-Seat-Cat.jpg,please have a seat,i hate to drink alone,155,1
https://i.imgflip.com/1a7y34.jpg,Take-A-Seat-Cat.jpg,you haven't been active recently on imgflip,you should probably make a meme for the front page,215,2
https://i.imgflip.com/1996ql.jpg,Take-A-Seat-Cat.jpg,"carl, carl, carl look its not you",its the terrible tuna fish you like,622,2
https://i.imgflip.com/16pdop.jpg,Take-A-Seat-Cat.jpg,you'll do,feed me,451,2
https://i.imgflip.com/13jv7c.jpg,Take-A-Seat-Cat.jpg,"well, you haven't been fired",but you've just been fired,608,3
https://i.imgflip.com/1qlp89.jpg,Take-A-Seat-Cat.jpg,we need to talk,is this just a thing or are we serious,1417,2
https://i.imgflip.com/1iyq30.jpg,Take-A-Seat-Cat.jpg,why don't you take a seat,and read this meme,193,1
https://i.imgflip.com/39rtbb.jpg,Take-A-Seat-Cat.jpg,sit down,i and your father are getting a divorce,492,0
https://i.imgflip.com/1mf90v.jpg,Take-A-Seat-Cat.jpg,"to be honest, the reason i don't like that food anymore",is because you stocked up while it was on sale,404,1
https://i.imgflip.com/1feu1w.jpg,Take-A-Seat-Cat.jpg,take a seat,i thought i told u not to have intercourse while in the house,337,1
https://i.imgflip.com/1avwfj.jpg,Take-A-Seat-Cat.jpg,"i almost voted for ""it's all about me"" ted cruz",i now regret that i couldn't have not voted twice,409,1
https://i.imgflip.com/20e5jn.jpg,Take-A-Seat-Cat.jpg,as the gop transfers our money to the wealthy,you have to ask yourself what they know about our country's economic stability that we don't.,1913,0
https://i.imgflip.com/zg6c6.jpg,Take-A-Seat-Cat.jpg,take a seat,the curtains are all torn up. probably due to the delicate material their made of,628,2
https://i.imgflip.com/y5gxh.jpg,Take-A-Seat-Cat.jpg,you know all those great freebees you hear about on line,it is you they are looking for and they gotcha,426,1
https://i.imgflip.com/1iaoz4.jpg,Take-A-Seat-Cat.jpg,"so, what is your talents",me: uhhh... does bottle flips count?,1454,0
https://i.imgflip.com/2ej5kx.jpg,Take-A-Seat-Cat.jpg,when it's all said and done,who will be left at the table.,1194,0
https://i.imgflip.com/25hew3.jpg,Take-A-Seat-Cat.jpg,we need to talk son,soooo no hooters for you so no car,2122,0
https://i.imgflip.com/49jik0.jpg,Take-A-Seat-Cat.jpg,kita perlu diskusi,tentang hubungan agama dan sains,680,1
https://i.imgflip.com/4kicpw.jpg,Take-A-Seat-Cat.jpg,i read your novel and i had some thoughts about it,you might want to sit down first,381,0
https://i.imgflip.com/40myju.jpg,Take-A-Seat-Cat.jpg,when your mom says nothing when coming home,and you relies that you live in a hispanic family,514,0
https://i.imgflip.com/3epg9x.jpg,Take-A-Seat-Cat.jpg,"we need to talk, but first",are you sitting on your cellphone?,589,1
https://i.imgflip.com/2ytcpt.jpg,Take-A-Seat-Cat.jpg,what do you mean you were here i saw you with your girlfriend,its ok... i did it to with your girl,371,0
https://i.imgflip.com/2sbk86.jpg,Take-A-Seat-Cat.jpg,i went on my phone,and notice my credit card has been spent on vbucks im basically saying im gonna beat your ass,246,0
https://i.imgflip.com/2h6r0g.jpg,Take-A-Seat-Cat.jpg,email: your stella & dot order shipped,me,223,0
https://i.imgflip.com/26bwos.jpg,Take-A-Seat-Cat.jpg,cut to the chase mr.dog,did you steal the cat mint?,268,0
https://i.imgflip.com/244cb8.jpg,Take-A-Seat-Cat.jpg,i think you know were my testicales went,tell me or i will take your!,158,0
https://i.imgflip.com/1wk5gd.jpg,Take-A-Seat-Cat.jpg,ok i repeat for the 21 345 342 time,where are my electric mouse!?!,175,0
https://i.imgflip.com/1k2tvd.jpg,Take-A-Seat-Cat.jpg,(comes home late),wares  my food bicth,158,0
https://i.imgflip.com/1i3x8j.jpg,Take-A-Seat-Cat.jpg,i am not pleased with your,appetite for the customers,364,0
https://i.imgflip.com/199b0r.jpg,Take-A-Seat-Cat.jpg,hi,would you like to talk about our lord jesus christ?,592,0
https://i.imgflip.com/1hek88.jpg,Take-A-Seat-Cat.jpg,i see all and know all,the meme under this sucks,109,0
https://i.imgflip.com/39qj1k.jpg,Take-A-Seat-Cat.jpg,i see you introduced a new cat in the household,which slipper do you want me to crap in first?,1165,1
https://i.imgflip.com/65olxb.jpg,Jackie-Chan-Confused.jpg,me when i watch man vs wild,and he starts to make a maxi best of menu with sand and 3 pieces of wood,137,1
https://i.imgflip.com/6029is.jpg,Jackie-Chan-Confused.jpg,covid can get by a vaccine & a booster,. . . but not a thin blue mask?!,1167,13
https://i.imgflip.com/5uq8kv.jpg,Jackie-Chan-Confused.jpg,studies 3-4 years to get an it degree,still cannot get jobs,782,5
https://i.imgflip.com/5vicmh.jpg,Jackie-Chan-Confused.jpg,why do we learn french,if we don't say french words in the furture,676,0
https://i.imgflip.com/51qazw.jpg,Jackie-Chan-Confused.jpg,why does it feel like that imgflip has so many 8-9 year olds just spamming the transparent images,and also choccy milk memes i see like 1-2 of those memes every time i visit imgflip,1892,14
https://i.imgflip.com/2nkhnb.jpg,Jackie-Chan-Confused.jpg,when the password you always use doesn't work,"and resetting the password says, you can't use your old password...",15154,0
https://i.imgflip.com/5xz5f2.jpg,Jackie-Chan-Confused.jpg,why is it called camouflage,when it's not,336,0
https://i.imgflip.com/52azwf.jpg,Jackie-Chan-Confused.jpg,when you download an anti virus,but you get the corona virus,1402,0
https://i.imgflip.com/56vef7.jpg,Jackie-Chan-Confused.jpg,i still don't understand,why is red sus all the time?,928,0
https://i.imgflip.com/2z5ysa.jpg,Jackie-Chan-Confused.jpg,when someone gets mad at you because,you killed them in a dream that they had,1959,0
https://i.imgflip.com/4gfjvc.jpg,Jackie-Chan-Confused.jpg,why those stupid people,make more coronavirus rule 34?,960,0
https://i.imgflip.com/4ks2e8.jpg,Jackie-Chan-Confused.jpg,husbands,trying to understand wife logic,641,4
https://i.imgflip.com/2rfb77.jpg,Jackie-Chan-Confused.jpg,when someone has more than 20 pictures of themselves,on the wall of their own house,1271,0
https://i.imgflip.com/36e5kx.jpg,Jackie-Chan-Confused.jpg,bash jews and get censored,bash islam and get 1000 upvotes,1548,0
https://i.imgflip.com/2pxanq.jpg,Jackie-Chan-Confused.jpg,my roommate just called me from upstairs,"said, make me coffee and then hung up",886,0
https://i.imgflip.com/4kv9ft.jpg,Jackie-Chan-Confused.jpg,when you see someone followed you on imgflip,even though your memes are terrible,505,0
https://i.imgflip.com/4nuh4w.jpg,Jackie-Chan-Confused.jpg,when you get accused of cheating and you're like,if i had someone better why would i still be with you,551,2
https://i.imgflip.com/30rssk.jpg,Jackie-Chan-Confused.jpg,you act that way and you,wonder why you get treated the way you do,642,0
https://i.imgflip.com/406plp.jpg,Jackie-Chan-Confused.jpg,when are obese people going to understand,that walking doesn't get them in shape,597,0
https://i.imgflip.com/2g017r.jpg,Jackie-Chan-Confused.jpg,imgflip says meme is featured,meme not on front page,562,0
https://i.imgflip.com/27clci.jpg,Jackie-Chan-Confused.jpg,how does the government use,face recognition in china,1596,0
https://i.imgflip.com/2hacog.jpg,Jackie-Chan-Confused.jpg,"when we don't put women in fighting games, feminists consider it prejudice","but when we do, then they remember it's rude to hit a woman",723,0
https://i.imgflip.com/3mzlb2.jpg,Jackie-Chan-Confused.jpg,when a woman gets married,and then wants to lose weight,612,0
https://i.imgflip.com/2s1az3.jpg,Jackie-Chan-Confused.jpg,i just got asked for id,to buy a pair of scissors,715,0
https://i.imgflip.com/4u8gpj.jpg,Jackie-Chan-Confused.jpg,why do folks berate those for hating or liking certain things,yet they easily get offended if somebody else does the same thing to them?,552,1
https://i.imgflip.com/2uq69m.jpg,Jackie-Chan-Confused.jpg,why do we park in a driveway,but drive in a parkway?,709,0
https://i.imgflip.com/31wa0k.jpg,Jackie-Chan-Confused.jpg,i used suave's clarifying shampoo,but i'm still just as confused as i was before my shower,789,7
https://i.imgflip.com/4are4j.jpg,Jackie-Chan-Confused.jpg,so some kid konichiwa to me and i say im not japanese. he then says annyeonghaseyo and i say im not korean,he responded by saying bonjour,202,0
https://i.imgflip.com/2veq92.jpg,Jackie-Chan-Confused.jpg,when you tell someone the milk is off,and they drink it anyway,379,0
https://i.imgflip.com/2iixns.jpg,Jackie-Chan-Confused.jpg,when you take a break from imgflip,and come back 3 months later to see how it turned out,495,0
https://i.imgflip.com/3ffn1r.jpg,Jackie-Chan-Confused.jpg,if cigarette taxes are supposed to reduce smoking,isnt income tax supposed to dicourage working,291,3
https://i.imgflip.com/2h5vhh.jpg,Jackie-Chan-Confused.jpg,when your coffee maker,says a cup is six ounces,302,0
https://i.imgflip.com/3uistv.jpg,Jackie-Chan-Confused.jpg,the definition of a shonen anime is an anime with a young protagonist,then what is dragon ball super?,471,3
https://i.imgflip.com/3iqnku.jpg,Jackie-Chan-Confused.jpg,can you understand the words coming out,of some of these memes?,476,0
https://i.imgflip.com/2omh5g.jpg,Jackie-Chan-Confused.jpg,put lots of thought in a meme and gets 18 upvotes,make on from top of your head and makes front page,520,5
https://i.imgflip.com/27kes1.jpg,Jackie-Chan-Confused.jpg,"""god created the sun on the fourth day""",then how did four days pass?,538,0
https://i.imgflip.com/2s4cma.jpg,Jackie-Chan-Confused.jpg,just what exactly,"does ""be like"" mean?",292,4
https://i.imgflip.com/3091nx.jpg,Jackie-Chan-Confused.jpg,spends hours on the internet,why did i read this?,211,4
https://i.imgflip.com/2f1dzm.jpg,Jackie-Chan-Confused.jpg,i'm confused. who or what does the democrats,stand for again?,320,0
https://i.imgflip.com/32uqk1.jpg,Jackie-Chan-Confused.jpg,i just ate a banana from amazon drone,i really wierded out,297,0
https://i.imgflip.com/2nqa8s.jpg,Jackie-Chan-Confused.jpg,when imgflip won't let you up your own comment,but lets you up your own image,305,0
https://i.imgflip.com/3r3i4u.jpg,Jackie-Chan-Confused.jpg,"cat runs out and i grab him. customer says, ""the delivery guy got him""","the other customer says, ""that's how it works""",1461,2
https://i.imgflip.com/27hmnx.jpg,Jackie-Chan-Confused.jpg,the world is so racist,they always use chinese people to do the king fu moves in movies,2271,0
https://i.imgflip.com/2tgpfv.jpg,Jackie-Chan-Confused.jpg,when you see an old woman,with really wide hips,730,3
https://i.imgflip.com/23mkw0.jpg,Jackie-Chan-Confused.jpg,when someone copies,your meme and gets more views,1905,3
https://i.imgflip.com/2k4a0t.jpg,Jackie-Chan-Confused.jpg,"i went to the imgflip page, and found out that",thereâ€™s a separate section just for cat memes,445,2
https://i.imgflip.com/3axjoq.jpg,Jackie-Chan-Confused.jpg,when the teachers pet escapes getting in trouble,and the rest of you get a demerit,314,3
https://i.imgflip.com/2j15gv.jpg,Jackie-Chan-Confused.jpg,when professors don't post grades,until after midterms,358,2
https://i.imgflip.com/2hwm9r.jpg,Jackie-Chan-Confused.jpg,what is the purpose,of the miku gifs?,271,3
https://i.imgflip.com/38o5zv.jpg,Jackie-Chan-Confused.jpg,memes gets 500 views,gets 0 likes,329,1
https://i.imgflip.com/24o6de.jpg,Jackie-Chan-Confused.jpg,when jobs dont hire you because you lack work experience,yet you need a job to get experience,693,0
https://i.imgflip.com/35iunm.jpg,Jackie-Chan-Confused.jpg,who decided 15 minutes was enough time,for a primary care office visit,371,1
https://i.imgflip.com/1s8sl4.jpg,Jackie-Chan-Confused.jpg,you miss me,but you don't want to talk?,634,3
https://i.imgflip.com/2c48qi.jpg,Jackie-Chan-Confused.jpg,client calls asking how their  mortgage approval is coming along,....still hasn't sent you any documentation,7507,2
https://i.imgflip.com/1auamv.jpg,Jackie-Chan-Confused.jpg,why would you ask a question i,just answered,1076,4
https://i.imgflip.com/30vp7c.jpg,Jackie-Chan-Confused.jpg,if onion make us cry,why broccoli not make us happy,230,1
https://i.imgflip.com/2myzai.jpg,Jackie-Chan-Confused.jpg,when someone enters an anime art school and doesn't know what anime is,you be like,363,0
https://i.imgflip.com/2vz0p0.jpg,Jackie-Chan-Confused.jpg,the fbi is going to charge celebrities for cheating to get their kids into a good school,but is okay with a politician compromising national security?,348,1
https://i.imgflip.com/2h3t8l.jpg,Jackie-Chan-Confused.jpg,m8,what is wrong with you,271,1
https://i.imgflip.com/2gai4k.jpg,Jackie-Chan-Confused.jpg,i just lost my drivers test because my instructer was colour blind,i went through a green light and he thought it was red!,219,1
https://i.imgflip.com/1dpyce.jpg,Jackie-Chan-Confused.jpg,what is,is going on here?,167394,0
https://i.imgflip.com/1uwk8z.jpg,Jackie-Chan-Confused.jpg,first week of college,got me like,3229,1
